{
  "$schema": "http://json-schema.org/draft-07/schema#",
  "$id": "https://github.com/jmagar/dendrite/plugins/schemas/gemini-extension.schema.json",
  "title": "Gemini CLI Extension Manifest",
  "description": "Docs-derived schema for gemini-extension.json. Based on the Gemini CLI extension reference and ExtensionConfig interface; Gemini CLI does not currently publish a standalone extension JSON Schema.",
  "type": "object",
  "additionalProperties": true,
  "required": ["name", "version"],
  "properties": {
    "$schema": {
      "type": "string"
    },
    "name": {
      "type": "string",
      "minLength": 1,
      "pattern": "^[a-z0-9][a-z0-9-]*$"
    },
    "version": {
      "type": "string",
      "minLength": 1
    },
    "description": {
      "type": "string"
    },
    "mcpServers": {
      "type": "object",
      "additionalProperties": {
        "type": "object"
      }
    },
    "contextFileName": {
      "oneOf": [
        {
          "type": "string",
          "minLength": 1
        },
        {
          "type": "array",
          "items": {
            "type": "string",
            "minLength": 1
          }
        }
      ]
    },
    "excludeTools": {
      "type": "array",
      "items": {
        "type": "string"
      }
    },
    "settings": {
      "type": "array",
      "items": {
        "$ref": "#/definitions/setting"
      }
    },
    "themes": {
      "type": "array",
      "items": {
        "type": "object"
      }
    },
    "plan": {
      "type": "object",
      "additionalProperties": true,
      "properties": {
        "directory": {
          "type": "string"
        }
      }
    },
    "migratedTo": {
      "type": "string"
    }
  },
  "definitions": {
    "setting": {
      "type": "object",
      "additionalProperties": true,
      "required": ["name", "description", "envVar", "sensitive"],
      "properties": {
        "name": {
          "type": "string",
          "minLength": 1
        },
        "description": {
          "type": "string",
          "minLength": 1
        },
        "envVar": {
          "type": "string",
          "pattern": "^[A-Z_][A-Z0-9_]*$"
        },
        "sensitive": {
          "type": "boolean"
        }
      }
    }
  }
}
