{
  "name": "bytestash",
  "version": "0.1.0",
  "description": "Skills for operating a ByteStash snippet manager.",
  "settings": [
    {
      "name": "API Key",
      "description": "Optional ByteStash API key for public/read-only endpoints. Snippet writes still require JWT on current ByteStash.",
      "envVar": "BYTESTASH_API_KEY",
      "sensitive": true
    },
    {
      "name": "Password",
      "description": "ByteStash password used by the hook to mint a JWT for snippet API calls.",
      "envVar": "BYTESTASH_PASSWORD",
      "sensitive": true
    },
    {
      "name": "JWT Token",
      "description": "Optional pre-minted ByteStash JWT. Used when username/password are not configured.",
      "envVar": "BYTESTASH_TOKEN",
      "sensitive": true
    },
    {
      "name": "ByteStash URL",
      "description": "Base URL of the ByteStash instance, including scheme. Do not include a trailing slash.",
      "envVar": "BYTESTASH_URL",
      "sensitive": false
    },
    {
      "name": "Username",
      "description": "ByteStash username. Recommended because current ByteStash snippet CRUD requires a JWT session token.",
      "envVar": "BYTESTASH_USERNAME",
      "sensitive": false
    }
  ]
}
