{
  "name": "memos",
  "version": "0.1.0",
  "description": "Skills for operating a Memos note hub.",
  "settings": [
    {
      "name": "API Token",
      "description": "Memos API token used for authenticated API requests.",
      "envVar": "MEMOS_API_TOKEN",
      "sensitive": true
    },
    {
      "name": "Memos URL",
      "description": "Base URL of the Memos instance, including scheme. Do not include a trailing slash.",
      "envVar": "MEMOS_URL",
      "sensitive": false
    }
  ]
}
