{
  "name": "adguard",
  "version": "0.1.0",
  "description": "Skill for operating adguard via the lab MCP server / CLI.",
  "settings": [
    {
      "name": "AdGuard URL",
      "description": "Base URL of the AdGuard Home instance, including scheme. Do not include a trailing slash or /control.",
      "envVar": "ADGUARD_URL",
      "sensitive": false
    },
    {
      "name": "Username",
      "description": "AdGuard Home username used for HTTP Basic authentication.",
      "envVar": "ADGUARD_USERNAME",
      "sensitive": false
    },
    {
      "name": "Password",
      "description": "AdGuard Home password used for HTTP Basic authentication.",
      "envVar": "ADGUARD_PASSWORD",
      "sensitive": true
    }
  ]
}
