{
  "name": "qdrant",
  "version": "0.1.0",
  "description": "Vector database collections and semantic search via direct calls to the Qdrant REST API.",
  "settings": [
    {
      "name": "API Key",
      "description": "Optional Qdrant API key. Leave blank for unauthenticated local deployments.",
      "envVar": "QDRANT_API_KEY",
      "sensitive": true
    },
    {
      "name": "Qdrant URL",
      "description": "Base URL of the Qdrant REST API, including scheme and port. Do not include a trailing slash.",
      "envVar": "QDRANT_URL",
      "sensitive": false
    }
  ]
}
