{
  "name": "vibin",
  "version": "0.1.0",
  "description": "Workflow, repo, GitHub, Windows, Paperless, MCP gateway, Jetpack Compose, and SWAG utility skills.",
  "settings": [
    {
      "name": "Paperless API Token",
      "description": "Paperless-ngx API token used in the Authorization: Token header.",
      "envVar": "PAPERLESS_API_TOKEN",
      "sensitive": true
    },
    {
      "name": "Paperless URL",
      "description": "Base URL of the Paperless-ngx instance, including scheme. Do not include a trailing slash.",
      "envVar": "PAPERLESS_URL",
      "sensitive": false
    },
    {
      "name": "SWAG container name",
      "description": "Container name used for nginx validation and logs. Default: 'swag'.",
      "envVar": "SWAG_CONTAINER_NAME",
      "sensitive": false
    },
    {
      "name": "SWAG default auth method",
      "description": "Default auth include set for new configs, such as authelia, authentik, tinyauth, ldap, or none. Default: 'authelia'.",
      "envVar": "SWAG_DEFAULT_AUTH_METHOD",
      "sensitive": false
    },
    {
      "name": "SWAG default QUIC setting",
      "description": "Default QUIC/HTTP3 setting for new configs. Default: 'false'.",
      "envVar": "SWAG_DEFAULT_ENABLE_QUIC",
      "sensitive": false
    },
    {
      "name": "SWAG default upstream protocol",
      "description": "Default upstream protocol for new configs. Default: 'http'.",
      "envVar": "SWAG_DEFAULT_UPSTREAM_PROTO",
      "sensitive": false
    },
    {
      "name": "SWAG edge SSH host",
      "description": "SSH host that owns the SWAG appdata/config directory.",
      "envVar": "SWAG_EDGE_HOST",
      "sensitive": false
    },
    {
      "name": "SWAG proxy-confs path",
      "description": "Host path to the SWAG nginx/proxy-confs directory.",
      "envVar": "SWAG_PROXY_CONFS_PATH",
      "sensitive": false
    },
    {
      "name": "SWAG public base domain",
      "description": "Base domain used for generated subdomains, such as example.com.",
      "envVar": "SWAG_PUBLIC_BASE_DOMAIN",
      "sensitive": false
    },
    {
      "name": "SWAG reload wait seconds",
      "description": "Seconds to wait for SWAG filewatch reload before health checks. Default: '30'.",
      "envVar": "SWAG_RELOAD_WAIT_SECONDS",
      "sensitive": false
    }
  ]
}
