{
  "name": "uptime-kuma",
  "version": "0.1.0",
  "description": "Read-only monitoring of a self-hosted Uptime Kuma instance via direct HTTP \u2014 Prometheus /metrics (API-key auth) and public status-page JSON. No monitor management (that requires Uptime Kuma's socket.io API).",
  "settings": [
    {
      "name": "Metrics API key",
      "description": "Uptime Kuma API key used to read the Prometheus /metrics endpoint via HTTP Basic auth (username blank, key as password). Create one under Settings \u2192 API Keys in the Uptime Kuma UI. Stored in secure OS storage, not settings.json.",
      "envVar": "UPTIME_KUMA_METRICS_API_KEY",
      "sensitive": true
    },
    {
      "name": "Status page slug",
      "description": "Optional slug of a published status page (the part after /status/ in its URL). Enables reading public status + heartbeat JSON without auth. Leave empty if you only use /metrics. Default: ''.",
      "envVar": "UPTIME_KUMA_STATUS_SLUG",
      "sensitive": false
    },
    {
      "name": "Uptime Kuma URL",
      "description": "Base URL of your Uptime Kuma instance, including scheme and (if non-default) port. Example: https://status.example.com or http://localhost:3001. No trailing slash needed. Default: 'http://localhost:3001'.",
      "envVar": "UPTIME_KUMA_URL",
      "sensitive": false
    }
  ]
}
