{
  "name": "neo4j",
  "version": "0.1.0",
  "description": "Operate a Neo4j graph database with Cypher over the HTTP transactional API or cypher-shell.",
  "settings": [
    {
      "name": "Database",
      "description": "Neo4j database name for transactional API calls. Default: 'neo4j'.",
      "envVar": "NEO4J_DB",
      "sensitive": false
    },
    {
      "name": "HTTP URL",
      "description": "Neo4j HTTP transactional API base URL, usually http://host:7474. Recommended for curl-based workflows.",
      "envVar": "NEO4J_HTTP_URL",
      "sensitive": false
    },
    {
      "name": "Password",
      "description": "Neo4j password used for HTTP Basic authentication and cypher-shell.",
      "envVar": "NEO4J_PASSWORD",
      "sensitive": true
    },
    {
      "name": "Bolt URL",
      "description": "Optional Neo4j Bolt URL, usually bolt://host:7687. Used by cypher-shell and as a fallback to derive the default HTTP URL.",
      "envVar": "NEO4J_URL",
      "sensitive": false
    },
    {
      "name": "Username",
      "description": "Neo4j username used for HTTP Basic authentication and cypher-shell.",
      "envVar": "NEO4J_USER",
      "sensitive": false
    }
  ]
}
