{
  "name": "navidrome",
  "version": "0.1.0",
  "description": "Operate a self-hosted Navidrome music server through its Subsonic API with direct HTTP calls \u2014 ping, browse artists/albums, search, and list playlists.",
  "settings": [
    {
      "name": "Password",
      "description": "Navidrome account password. Used only to derive the per-request Subsonic token = md5(password + salt); the raw password is never sent over the wire. Stored in secure OS storage, not settings.json.",
      "envVar": "NAVIDROME_PASSWORD",
      "sensitive": true
    },
    {
      "name": "Navidrome URL",
      "description": "Base URL of your Navidrome server, including scheme and (if non-default) port. Example: https://music.example.com or http://localhost:4533. Do NOT include a trailing /rest path \u2014 the skill appends Subsonic endpoints. Default: 'http://localhost:4533'.",
      "envVar": "NAVIDROME_URL",
      "sensitive": false
    },
    {
      "name": "Username",
      "description": "Navidrome account username used for Subsonic API authentication.",
      "envVar": "NAVIDROME_USERNAME",
      "sensitive": false
    }
  ]
}
