{
  "name": "dozzle",
  "version": "0.1.0",
  "description": "Skill for operating Dozzle through direct HTTP API checks, auth guidance, and MCP setup notes.",
  "mcpServers": {
    "dozzle": {
      "type": "http",
      "url": "${DOZZLE_MCP_URL}"
    }
  },
  "settings": [
    {
      "name": "Dozzle MCP URL",
      "description": "Dozzle's native Streamable HTTP MCP endpoint. Enable Dozzle with DOZZLE_ENABLE_MCP=true or --enable-mcp, then point this at the reachable /api/mcp URL. Include any configured base path before /api/mcp. Default: 'http://localhost:8080/api/mcp'.",
      "envVar": "DOZZLE_MCP_URL",
      "sensitive": false
    }
  ]
}
