{
  "name": "linkding",
  "version": "0.1.0",
  "description": "Skills for operating a Linkding bookmark manager.",
  "settings": [
    {
      "name": "API Key",
      "description": "Linkding API token used in the Authorization: Token header.",
      "envVar": "LINKDING_API_KEY",
      "sensitive": true
    },
    {
      "name": "Linkding URL",
      "description": "Base URL of the Linkding instance, including scheme. Do not include a trailing slash.",
      "envVar": "LINKDING_URL",
      "sensitive": false
    }
  ]
}
