{
  "name": "arrs",
  "version": "0.1.0",
  "description": "The *arr / media-automation stack in one plugin: Radarr, Sonarr, Prowlarr, Overseerr, SABnzbd, qBittorrent, Plex, Jellyfin, Tautulli, and Tracearr \u2014 each operated via its own REST API. Credentials are configured here and bridged to the skills via a generated env file.",
  "settings": [
    {
      "name": "Jellyfin API key",
      "description": "Jellyfin API key (Dashboard \u2192 API Keys), sent as X-Emby-Token.",
      "envVar": "JELLYFIN_API_KEY",
      "sensitive": true
    },
    {
      "name": "Jellyfin URL",
      "description": "Jellyfin base URL, e.g. http://localhost:8096 (no trailing slash).",
      "envVar": "JELLYFIN_URL",
      "sensitive": false
    },
    {
      "name": "Overseerr API key",
      "description": "Overseerr API key (Settings \u2192 General).",
      "envVar": "OVERSEERR_API_KEY",
      "sensitive": true
    },
    {
      "name": "Overseerr URL",
      "description": "Overseerr base URL, e.g. http://localhost:5055 (no trailing slash).",
      "envVar": "OVERSEERR_URL",
      "sensitive": false
    },
    {
      "name": "Plex token",
      "description": "Plex X-Plex-Token.",
      "envVar": "PLEX_TOKEN",
      "sensitive": true
    },
    {
      "name": "Plex URL",
      "description": "Plex Media Server base URL incl. port, e.g. http://localhost:32400.",
      "envVar": "PLEX_URL",
      "sensitive": false
    },
    {
      "name": "Prowlarr API key",
      "description": "Prowlarr API key (Settings \u2192 General).",
      "envVar": "PROWLARR_API_KEY",
      "sensitive": true
    },
    {
      "name": "Prowlarr URL",
      "description": "Prowlarr base URL, e.g. http://localhost:9696 (no trailing slash).",
      "envVar": "PROWLARR_URL",
      "sensitive": false
    },
    {
      "name": "qBittorrent password",
      "description": "qBittorrent WebUI password.",
      "envVar": "QBITTORRENT_PASSWORD",
      "sensitive": true
    },
    {
      "name": "qBittorrent URL",
      "description": "qBittorrent WebUI base URL, e.g. http://localhost:8080 (no trailing slash).",
      "envVar": "QBITTORRENT_URL",
      "sensitive": false
    },
    {
      "name": "qBittorrent username",
      "description": "qBittorrent WebUI username.",
      "envVar": "QBITTORRENT_USERNAME",
      "sensitive": false
    },
    {
      "name": "Radarr API key",
      "description": "Radarr API key (Settings \u2192 General).",
      "envVar": "RADARR_API_KEY",
      "sensitive": true
    },
    {
      "name": "Radarr default quality profile",
      "description": "Quality profile id used when adding movies. Default: '1'.",
      "envVar": "RADARR_DEFAULT_QUALITY_PROFILE",
      "sensitive": false
    },
    {
      "name": "Radarr URL",
      "description": "Radarr base URL, e.g. http://localhost:7878 (no trailing slash).",
      "envVar": "RADARR_URL",
      "sensitive": false
    },
    {
      "name": "SABnzbd API key",
      "description": "SABnzbd API key (Config \u2192 General).",
      "envVar": "SABNZBD_API_KEY",
      "sensitive": true
    },
    {
      "name": "SABnzbd URL",
      "description": "SABnzbd base URL, e.g. http://localhost:8080 (no trailing slash).",
      "envVar": "SABNZBD_URL",
      "sensitive": false
    },
    {
      "name": "Sonarr API key",
      "description": "Sonarr API key (Settings \u2192 General).",
      "envVar": "SONARR_API_KEY",
      "sensitive": true
    },
    {
      "name": "Sonarr default quality profile",
      "description": "Quality profile id used when adding series. Default: '1'.",
      "envVar": "SONARR_DEFAULT_QUALITY_PROFILE",
      "sensitive": false
    },
    {
      "name": "Sonarr URL",
      "description": "Sonarr base URL, e.g. http://localhost:8989 (no trailing slash).",
      "envVar": "SONARR_URL",
      "sensitive": false
    },
    {
      "name": "Tautulli API key",
      "description": "Tautulli API key (Settings \u2192 Web Interface).",
      "envVar": "TAUTULLI_API_KEY",
      "sensitive": true
    },
    {
      "name": "Tautulli URL",
      "description": "Tautulli base URL incl. port, e.g. http://localhost:8181.",
      "envVar": "TAUTULLI_URL",
      "sensitive": false
    },
    {
      "name": "Tracearr URL",
      "description": "Tracearr base URL for its public API, e.g. http://localhost:3000 (no trailing slash).",
      "envVar": "TRACEARR_URL",
      "sensitive": false
    }
  ]
}
