{
  "name": "radicale",
  "version": "0.1.0",
  "description": "CalDAV and CardDAV workflow skills for Radicale.",
  "settings": [
    {
      "name": "Password",
      "description": "Radicale password.",
      "envVar": "RADICALE_PASSWORD",
      "sensitive": true
    },
    {
      "name": "Radicale URL",
      "description": "Base URL of the Radicale CalDAV/CardDAV server, including scheme.",
      "envVar": "RADICALE_URL",
      "sensitive": false
    },
    {
      "name": "Username",
      "description": "Radicale username.",
      "envVar": "RADICALE_USERNAME",
      "sensitive": false
    }
  ]
}
