{
  "name": "immich",
  "version": "0.1.0",
  "description": "Skill for operating immich via the lab MCP server / CLI.",
  "settings": [
    {
      "name": "API Key",
      "description": "Immich API key for authenticated requests.",
      "envVar": "IMMICH_API_KEY",
      "sensitive": true
    },
    {
      "name": "Immich URL",
      "description": "Base URL of the Immich API, including scheme. Do not include a trailing slash.",
      "envVar": "IMMICH_URL",
      "sensitive": false
    }
  ]
}
